{
  "name": "bohort",
  "declared_level": null,
  "traces": {
    "pr_sizes": [
      "S",
      "S",
      "S",
      "S",
      "S",
      "S",
      "S",
      "S",
      "S",
      "S",
      "S",
      "S",
      "S",
      "S",
      "S",
      "S",
      "M",
      "M",
      "M",
      "M",
      "M",
      "M",
      "M",
      "M",
      "M",
      "M",
      "M",
      "M",
      "M",
      "M",
      "M",
      "M",
      "M",
      "M",
      "M",
      "M",
      "M",
      "M",
      "M",
      "M",
      "L",
      "L",
      "L",
      "L",
      "L",
      "L",
      "L",
      "XL"
    ],
    "parallel_projects": 3,
    "projects_completed": 3,
    "context_versioned": true,
    "agent_rules_versioned": false,
    "retry_loops": false,
    "prompts": true,
    "retries_after_fact": 0.16666666666666666,
    "retries_triangulated": true,
    "agents_autonomous": false
  },
  "answers": {},
  "meta": {
    "source_dir": "..\\laivel-up\\profiles\\bohort"
  }
}