{
  "name": "arthur",
  "declared_level": null,
  "traces": {
    "pr_sizes": [
      "S",
      "S",
      "S",
      "S",
      "S",
      "S",
      "S",
      "S",
      "S",
      "S",
      "S",
      "S",
      "M",
      "M",
      "M",
      "M",
      "M",
      "M",
      "M",
      "M",
      "M",
      "M",
      "M",
      "M",
      "M",
      "M",
      "M",
      "M",
      "M",
      "M",
      "M",
      "M",
      "M",
      "M",
      "M",
      "M",
      "M",
      "M",
      "M",
      "M",
      "M",
      "L",
      "L",
      "L",
      "L",
      "L",
      "L",
      "L",
      "L",
      "L",
      "L",
      "L",
      "L",
      "L",
      "L",
      "L",
      "L",
      "L",
      "L",
      "L",
      "L",
      "L",
      "L",
      "L",
      "L",
      "L",
      "L",
      "L",
      "L",
      "L",
      "L",
      "L",
      "L",
      "L",
      "L",
      "L",
      "L",
      "L",
      "L",
      "L",
      "L",
      "L",
      "L",
      "L",
      "L",
      "L",
      "L",
      "L",
      "L",
      "L",
      "L",
      "L",
      "L",
      "L",
      "L",
      "L",
      "L",
      "L",
      "L",
      "L",
      "L",
      "L",
      "L",
      "L",
      "L",
      "L",
      "XL",
      "XL",
      "XL",
      "XL",
      "XL",
      "XL",
      "XL",
      "XL",
      "XL",
      "XL",
      "XL",
      "XL",
      "XL",
      "XL",
      "XL",
      "XL",
      "XL",
      "XL",
      "XL",
      "XL",
      "XL",
      "XL",
      "XL",
      "XL",
      "XL",
      "XL",
      "XL",
      "XL",
      "XL",
      "XL",
      "XL",
      "XL",
      "XL",
      "XL",
      "XL",
      "XL",
      "XL",
      "XL",
      "XL",
      "XL",
      "XL",
      "XL",
      "XL",
      "XL",
      "XL",
      "XL",
      "XL",
      "XL"
    ],
    "parallel_projects": 7,
    "projects_completed": 6,
    "context_versioned": true,
    "agent_rules_versioned": true,
    "retry_loops": false,
    "prompts": true,
    "retries_after_fact": 0.02127659574468085,
    "retries_triangulated": true,
    "agents_autonomous": false
  },
  "answers": {},
  "meta": {
    "source_dir": "..\\laivel-up\\profiles\\arthur"
  }
}