{
  "name": "leodagan",
  "declared_level": null,
  "traces": {
    "pr_sizes": [
      "S",
      "S",
      "S",
      "S",
      "S",
      "S",
      "S",
      "S",
      "S",
      "S",
      "M",
      "M",
      "M",
      "M",
      "M",
      "M",
      "M",
      "M",
      "M",
      "M",
      "M",
      "M",
      "M",
      "M",
      "M",
      "M",
      "M",
      "M",
      "M",
      "M",
      "M",
      "L",
      "L",
      "L",
      "L",
      "L",
      "L",
      "L",
      "L",
      "L",
      "L",
      "L",
      "L",
      "L",
      "L",
      "L",
      "L",
      "L",
      "L",
      "L",
      "L",
      "L",
      "L",
      "L",
      "L",
      "L",
      "L",
      "L",
      "L",
      "L",
      "L",
      "L",
      "L",
      "XL",
      "XL",
      "XL",
      "XL",
      "XL",
      "XL",
      "XL",
      "XL"
    ],
    "parallel_projects": 2,
    "projects_completed": 4,
    "context_versioned": true,
    "agent_rules_versioned": true,
    "retry_loops": true,
    "prompts": true,
    "retries_after_fact": 0.0,
    "retries_triangulated": true
  },
  "answers": {},
  "meta": {
    "source_dir": "..\\laivel-up\\profiles\\leodagan"
  }
}