{
  "name": "perceval",
  "declared_level": "RED",
  "traces": {
    "pr_sizes": [
      "S",
      "S",
      "S",
      "S",
      "S",
      "S",
      "S",
      "S",
      "S",
      "S",
      "S",
      "S",
      "S",
      "S",
      "S",
      "S",
      "S",
      "S",
      "S",
      "S",
      "S",
      "S",
      "S",
      "S",
      "S",
      "S",
      "S",
      "S",
      "S",
      "S",
      "S",
      "S",
      "S",
      "S",
      "S",
      "S",
      "S",
      "S",
      "S",
      "S",
      "S",
      "S",
      "S",
      "S",
      "S",
      "S",
      "S",
      "S",
      "S",
      "S",
      "S",
      "S",
      "M",
      "M",
      "M",
      "M",
      "M",
      "M",
      "M",
      "M",
      "M",
      "M",
      "L"
    ],
    "parallel_projects": 2,
    "projects_completed": 2,
    "context_versioned": false,
    "agent_rules_versioned": false,
    "retry_loops": false,
    "prompts": true,
    "retries_after_fact": 0.5714285714285714,
    "retries_triangulated": true
  },
  "answers": {},
  "meta": {
    "source_dir": "..\\laivel-up\\profiles\\perceval"
  }
}